<?xml version="1.0" encoding="UTF-8"?>
<jdbcluster xmlns:xsi="http://www.w3.org/2001/XMLSchema-instance" xsi:noNamespaceSchemaLocation="http://jdbcluster.sourceforge.net/jdbcluster.xsd">
	<privileges>
		<UserPrivilegeChecker class="mycluster.privilege.UserPrivilege"/>
	</privileges>
	<!-- Definition of available Cluster Objects-->
	<clustertype>
		<!--configure cluster CAuto-->
		<cluster id="car" class="mycluster.CCar">
			<!--special filter "name" for cluster CAuto is available-->
			<!--select: ...where NAME=test.testfilter.NameFilter.getName()-->
			<select id="name" hql="NAME=:UNITNAME">
				<FilterClass class="test.testfilter.NameFilter">
					<binding var="UNITNAME" attribute="name"/>
				</FilterClass>
			</select>
			<!--select for coordinates-->
			<select id="position" hql="LATITUDE=:LAT and LONGITUDE=:LONG">
				<FilterClass class="test.testfilter.PositionFilter">
					<binding var="LONG" attribute="longitude"/>
					<binding var="LAT" attribute="latitude"/>
				</FilterClass>
			</select>
			<!--select only for LATITUDE-->
			<select id="positionLatOnly" hql="LATITUDE=:LATONLY">
				<FilterClass class="test.testfilter.PositionFilter">
					<binding var="LATONLY" attribute="latitude"/>
				</FilterClass>
			</select>
		</cluster>
		<!--configure cluster CFahrrad-->
		<cluster id="bicycle" class="mycluster.CBicycle"/>
	</clustertype>
	
	<!--confure available dao classes-->
	<daotype>
		<!--configure dao class Auto-->
		<dao id="Car" class="dao.Car">
			<!--sets parameter longitude to 1.234-->
			<property name="longitude">
				<value>1.234</value>
			</property>
			<!--sets parameter latitude to 5.678-->
			<property name="latitude">
				<value>5.678</value>
			</property>
			<!--sets parameter name to MyDefaultAutoName-->
			<property name="name">
				<value>MyDefaultAutoName</value>
			</property>
		</dao>
	</daotype>
	
	<!-- configure domain dependancies-->
	<!-- this Example is shown in CFahrrad...-->
	<domaindependancy>
		<!-- define all "not" masterdomains -->
		<domain domainid="ColorShadingDomain" domainlistclass="mycluster.domain.ColorShadingDomainList"/>
		<!-- define master domain "ColorTypeDomain"-->
		<domain domainid="ColorTypeDomain" domainlistclass="mycluster.domain.ColorTypeDomainList">
			<!-- define entries for slave domain "ColorDomain" -->
			<entry value="Color" slavedomainid="ColorDomain">
				<valid value="RED"/>
				<valid value="GREEN"/>
				<valid value="BLUE"/>
			</entry>
			<entry value="BlackWhite" slavedomainid="ColorDomain">
				<valid value="BLACK"/>
				<valid value="WHITE"/>
				<valid value="GREY50%"/>
			</entry>
			<entry value="None" slavedomainid="ColorDomain">
				<invalid all="true"/>
			</entry>
			<entry value="All" slavedomainid="ColorDomain">
				<valid all="true" null="true"/>
			</entry>
		</domain>
		<!-- define master domain "ColorDomain"-->
		<domain domainid="ColorDomain" domainlistclass="mycluster.domain.ColorDomainList">
			<!-- wildcard for all undefined master domain values-->
			<entry value="*" slavedomainid="ColorShadingDomain"/>
			<!-- except master domain value "RED" is checked -->
			<entry value="RED" slavedomainid="ColorShadingDomain">
				<valid value="LightRED"/>
				<valid value="DarkRED"/>
				<additionalmaster value="All" masterdomainid="ColorTypeDomain">
					<invalid value="LightRED"/>
					<valid value="MiddleRED"/>
				</additionalmaster>
			</entry>
		</domain>
	</domaindependancy>
</jdbcluster>
