<?xml version="1.0" encoding="UTF-8"?>
<!-- 

categoryCode		subCatCode		subSubCatCode		subSubSubCatCode		
[null]				[null]			[null]				[null]					
________________________________________________________________________________
A1					[null]			[any],[null]		[null]
					____________________________________________________________
					A2				[any],[null]		A4,[null]
					____________________________________________________________
					B2				A3,[null]			[any],[null]
________________________________________________________________________________
B1					[null]			[any],[null]		[null]							
					____________________________________________________________
					A2				[any],[null]		A4,[null]
					____________________________________________________________
					B2				B3,[null]			B4,[null]
					
 -->
<jdbcluster xmlns:xsi="http://www.w3.org/2001/XMLSchema-instance" xsi:noNamespaceSchemaLocation="jdbcluster.xsd">
	<privileges>
		<UserPrivilegeChecker class="UserPrivilege"/>
	</privileges>
	<clustertype>
		<cluster class="test.domain.adddomain.AddDomainCluster" id="AddDomainCluster"/>
	</clustertype>
	<domaindependancy>
		<domain domainid="categoryCode" domainlistclass="test.domain.adddomain.AddDomainList">
			<entry null="true" slavedomainid="subCatCode">
				<valid null="true"/>
			</entry>
			<entry value="A1" slavedomainid="subCatCode">
				<valid null="true"/>
				<valid value="A2"/>
				<valid value="B2"/>
			</entry>
			<entry value="B1" slavedomainid="subCatCode">
				<valid null="true"/>
				<valid value="A2"/>
				<valid value="B2"/>
			</entry>
		</domain>
		<domain domainid="subCatCode" domainlistclass="test.domain.adddomain.AddDomainList">
			<entry null="true" slavedomainid="subSubCatCode">
				<valid null="true"/>
				<additionalmaster value="A1" masterdomainid="categoryCode">
					<valid null="true" all="true"/>
				</additionalmaster>
				<additionalmaster value="B1" masterdomainid="categoryCode">
					<valid null="true" all="true"/>
				</additionalmaster>
			</entry>
			<entry value="A2" slavedomainid="subSubCatCode">
				<valid all="true" null="true"/>
			</entry>
			<entry value="B2" slavedomainid="subSubCatCode">
				<valid null="true"/>
				<additionalmaster value="A1" masterdomainid="categoryCode">
					<valid value="A3"/>
				</additionalmaster>
				<additionalmaster value="B1" masterdomainid="categoryCode">
					<valid value="B3"/>
				</additionalmaster>
			</entry>
		</domain>
		<domain domainid="subSubCatCode" domainlistclass="test.domain.adddomain.AddDomainList">
			<entry null="true" slavedomainid="subSubSubCatCode">
				<valid null="true"/>
				<additionalmaster value="A2" masterdomainid="subCatCode">
					<valid value="A4"/>
				</additionalmaster>
				<additionalmaster value="A1" masterdomainid="categoryCode">
					<additionalmaster value="B2" masterdomainid="subCatCode">
						<valid null="true" all="true"/>
					</additionalmaster>
				</additionalmaster>
				<additionalmaster value="B1" masterdomainid="categoryCode">
					<additionalmaster value="B2" masterdomainid="subCatCode">
						<valid value="B4"/>
					</additionalmaster>
				</additionalmaster>
			</entry>
			<entry value="A3" slavedomainid="subSubSubCatCode">
				<valid null="true"/>
				<additionalmaster value="A2" masterdomainid="subCatCode">
					<valid value="A4"/>
				</additionalmaster>
				<additionalmaster value="A1" masterdomainid="categoryCode">
					<additionalmaster value="B2" masterdomainid="subCatCode">
						<valid null="true" all="true"/>
					</additionalmaster>
				</additionalmaster>
			</entry>
			<entry value="B3" slavedomainid="subSubSubCatCode">
				<valid null="true"/>
				<additionalmaster value="A2" masterdomainid="subCatCode">
					<valid value="A4"/>
				</additionalmaster>
				<additionalmaster value="B1" masterdomainid="categoryCode">
					<additionalmaster value="B2" masterdomainid="subCatCode">
						<valid value="B4"/>
					</additionalmaster>
				</additionalmaster>
			</entry>
		</domain>
		<domain domainid="subSubSubCatCode" domainlistclass="test.domain.adddomain.AddDomainList"/>
	</domaindependancy>
</jdbcluster>
